{
  "schemaVersion": 1,
  "id": "claude:0f8c2a6e-1111-4222-8333-944455556666",
  "provider": "claude",
  "project": "apps/demo",
  "repoRoot": "C:/Users/example/Projects/workspace",
  "model": "claude-opus-5-5",
  "effort": "high",
  "startedAt": "2026-10-19T14:00:00.000Z",
  "endedAt": "2026-10-19T15:10:00.000Z",
  "week": "2026-W43",
  "automated": false,
  "taskType": "feature",
  "hasSpec": true,
  "specSignals": ["requirements-section", "acceptance-section"],
  "promptChars": 104,
  "userTurns": 3,
  "corrections": { "count": 1, "byCategory": { "wrong-result": 1 },
    "items": [ { "turn": 1, "category": "wrong-result", "rule": "es-no-funciona", "source": "rule", "excerpt": "no funciona, sigue saliendo Hello en español" } ] },
  "interruptions": 1,
  "doneClaims": 2,
  "falseDone": { "count": 1, "items": [ { "claimTurn": 0, "reportTurn": 1, "claimExcerpt": "Done: Spanish greeting implemented and tests pass.", "reportExcerpt": "no funciona, sigue saliendo Hello en español" } ] },
  "commits": [ { "sha": "a1b2c3d", "turn": 2, "repoRoot": "C:/Users/example/Projects/workspace", "verifiedBefore": true, "followUp": "none" } ],
  "turnsToFirstVerifiedCommit": 3,
  "commitsChecked72h": 1,
  "commitsFixedOrReverted72h": 0,
  "tokens": { "input": 168000, "cached": 148000, "cacheWrite": 12000, "output": 4800, "reasoning": 1200, "total": 172800 },
  "compactions": 1,
  "toolCalls": 12,
  "toolErrors": 1,
  "modelPass": { "status": "skipped" },
  "coverage": { "transcriptComplete": true, "gitChecked": true }
}
